{
  "id": "antigravity-context7-auto-research",
  "name": "context7-auto-research",
  "slug": "context7-auto-research",
  "description": "Automatically fetch latest library/framework documentation for Claude Code via Context7 API",
  "category": "Document Processing",
  "source": "antigravity",
  "repoUrl": "https://github.com/sickn33/antigravity-awesome-skills",
  "skillUrl": "https://github.com/sickn33/antigravity-awesome-skills/tree/main/skills/context7-auto-research",
  "content": "\n# context7-auto-research\n\n## Overview\nAutomatically fetch latest library/framework documentation for Claude Code via Context7 API\n\n## When to Use\n- When you need up-to-date documentation for libraries and frameworks\n- When asking about React, Next.js, Prisma, or any other popular library\n\n## Installation\n```bash\nnpx skills add -g BenedictKing/context7-auto-research\n```\n\n## Step-by-Step Guide\n1. Install the skill using the command above\n2. Configure API key (optional, see GitHub repo for details)\n3. Use naturally in Claude Code conversations\n\n## Examples\nSee [GitHub Repository](https://github.com/BenedictKing/context7-auto-research) for examples.\n\n## Best Practices\n- Configure API keys via environment variables for higher rate limits\n- Use the skill's auto-trigger feature for seamless integration\n\n## Troubleshooting\nSee the GitHub repository for troubleshooting guides.\n\n## Related Skills\n- tavily-web, exa-search, firecrawl-scraper, codex-review\n",
  "tags": [
    "react",
    "api",
    "claude",
    "ai",
    "document",
    "prisma"
  ],
  "useCases": [
    "When you need up-to-date documentation for libraries and frameworks",
    "When asking about React, Next.js, Prisma, or any other popular library"
  ],
  "scrapedAt": "2026-01-26T13:17:50.543Z"
}